{
  "screen_id": "canvas-003",
  "viewport": [
    1280,
    720
  ],
  "dpr": 1,
  "items": [
    {
      "entity": "PAN",
      "box": [
        40,
        154,
        140,
        22
      ],
      "value_hash": "sha256:ddeabe7577fa19794ea189cfe484dfc97a6572af4ed31f0bc60944e895d5c709"
    },
    {
      "entity": "UNKNOWN_SENSITIVE",
      "box": [
        16,
        680,
        260,
        16
      ],
      "canary": true,
      "canary_id": "CANARYSMK6MC52EG37K5T9LBFRC6"
    }
  ],
  "tasks": []
}
