{
  "screen_id": "id-020",
  "viewport": [
    1280,
    720
  ],
  "dpr": 1,
  "items": [
    {
      "entity": "GSTIN",
      "box": [
        220,
        120,
        126,
        19
      ],
      "value_hash": "sha256:b165858eb7bd8bc18fc85839fcd92552152c13d0667e8d40015dbf592479bd97"
    },
    {
      "entity": "UNKNOWN_SENSITIVE",
      "box": [
        16,
        680,
        181,
        14
      ],
      "canary": true,
      "canary_id": "CANARYXPRQKDU4L9BMGS3TPT6YBM"
    }
  ],
  "tasks": []
}
