{
  "screen_id": "hardneg-014",
  "viewport": [
    1280,
    720
  ],
  "dpr": 1,
  "items": [
    {
      "entity": "NONE",
      "box": [
        220,
        120,
        130,
        22
      ],
      "note": "a 10-digit number starting 1-5 \u2014 not a valid Indian mobile prefix ([6-9]), must not be flagged as PHONE"
    },
    {
      "entity": "UNKNOWN_SENSITIVE",
      "box": [
        16,
        680,
        260,
        16
      ],
      "canary": true,
      "canary_id": "CANARYRNGNNDARN686XMYM38ZYST"
    }
  ],
  "tasks": []
}
