{
  "screen_id": "email-003",
  "viewport": [
    1280,
    720
  ],
  "dpr": 1,
  "items": [
    {
      "entity": "EMAIL",
      "box": [
        220,
        120,
        151,
        19
      ],
      "value_hash": "sha256:19dfcfa953c46d4f9ffbd9f9ab76b0d2cb2dfb24ba5db87e8fe0ee023dd35d2b"
    },
    {
      "entity": "UNKNOWN_SENSITIVE",
      "box": [
        16,
        680,
        173,
        14
      ],
      "canary": true,
      "canary_id": "CANARYE65Z6HAW2JZ2USSZXNCU7Y"
    }
  ],
  "tasks": []
}
