{
  "screen_id": "freetext-009",
  "viewport": [
    1280,
    720
  ],
  "dpr": 1,
  "items": [
    {
      "entity": "SECRET",
      "box": [
        220,
        120,
        900,
        22
      ],
      "value_hash": "sha256:61a18887db9c9d5abbfb04002493d0107871f16679dbaecbc214995856f62df5"
    },
    {
      "entity": "UNKNOWN_SENSITIVE",
      "box": [
        16,
        680,
        260,
        16
      ],
      "canary": true,
      "canary_id": "CANARYPLUJ75HKML4AWR84NWR37L"
    }
  ],
  "tasks": []
}
