{
  "screen_id": "health-013",
  "viewport": [
    1280,
    720
  ],
  "dpr": 1,
  "items": [
    {
      "entity": "PERSON_NAME",
      "box": [
        220,
        120,
        49,
        19
      ],
      "value_hash": "sha256:395d1fb8c6d4b97b28b2bada6603237aebc655f3c45e105d3b41a1234ebbe2ef"
    },
    {
      "entity": "PHONE",
      "box": [
        220,
        160,
        108,
        19
      ],
      "value_hash": "sha256:64aba0f1ce23191b02c8fc041e5ba075ebdcc93132a6ed871d31e6277d34e658"
    },
    {
      "entity": "UNKNOWN_SENSITIVE",
      "box": [
        16,
        680,
        175,
        14
      ],
      "canary": true,
      "canary_id": "CANARYVARL66FNLUYBY8WD7JNCD3"
    }
  ],
  "tasks": []
}
