{
  "screen_id": "faces-008",
  "viewport": [
    1280,
    720
  ],
  "dpr": 1,
  "items": [
    {
      "entity": "ID_DOCUMENT",
      "box": [
        220,
        120,
        260,
        160
      ]
    },
    {
      "entity": "UNKNOWN_SENSITIVE",
      "box": [
        16,
        680,
        176,
        14
      ],
      "canary": true,
      "canary_id": "CANARY5DQEXL7KZN4KGBZCU5TVRV"
    }
  ],
  "tasks": []
}
