{
  "screen_id": "freetext-003",
  "viewport": [
    1280,
    720
  ],
  "dpr": 1,
  "items": [
    {
      "entity": "PERSON_NAME",
      "box": [
        16,
        60,
        260,
        22
      ],
      "value_hash": "sha256:4b46367c965cfcd27e98238a2466aee23180b67f15a8d744a6ec798b67210e1e"
    },
    {
      "entity": "EMAIL",
      "box": [
        16,
        90,
        260,
        22
      ],
      "value_hash": "sha256:40c6b33a9be4a497dbfc3e4be0cf2ca274fd17e68db0eb2a12848c48d7837381"
    },
    {
      "entity": "UNKNOWN_SENSITIVE",
      "box": [
        16,
        680,
        260,
        16
      ],
      "canary": true,
      "canary_id": "CANARYVEP5J7MYSZL8PGLFHRTS3P"
    }
  ],
  "tasks": []
}
