{
  "screen_id": "indic-015",
  "viewport": [
    1280,
    720
  ],
  "dpr": 1,
  "items": [
    {
      "entity": "PHONE",
      "box": [
        220,
        120,
        200,
        22
      ],
      "value_hash": "sha256:ba6804cc815c48d462504526bc62f7fddecc4907d0e4bc9cff8a95de02042d18"
    },
    {
      "entity": "UNKNOWN_SENSITIVE",
      "box": [
        16,
        680,
        260,
        16
      ],
      "canary": true,
      "canary_id": "CANARYZHBKTUZRELEFF74GA449TA"
    }
  ],
  "tasks": []
}
