{
  "screen_id": "hardneg-026",
  "viewport": [
    1280,
    720
  ],
  "dpr": 1,
  "items": [
    {
      "entity": "NONE",
      "box": [
        220,
        120,
        150,
        22
      ],
      "note": "10-digit order number starting 1-5 \u2014 phone.ts's INDIAN_MOBILE_RE requires a 6-9 first digit, so this cannot match as PHONE."
    },
    {
      "entity": "UNKNOWN_SENSITIVE",
      "box": [
        16,
        680,
        174,
        14
      ],
      "canary": true,
      "canary_id": "CANARYMJ75UY99QPG29SZ95UZTSN"
    }
  ],
  "tasks": []
}
