{
  "screen_id": "social-009",
  "viewport": [
    1280,
    720
  ],
  "dpr": 1,
  "items": [
    {
      "entity": "USERNAME",
      "box": [
        220,
        120,
        78,
        19
      ],
      "value_hash": "sha256:413808565e45c1007f9c6d6934d7bcfc26b35a1c3ea2d07705c5a6ceff30935f"
    },
    {
      "entity": "PERSON_NAME",
      "box": [
        220,
        160,
        53,
        19
      ],
      "value_hash": "sha256:bda634ab2fe0d0f739ad14a1d3fd7b81a66ea943592bf1ab8c21d8a10a8ab264"
    },
    {
      "entity": "UNKNOWN_SENSITIVE",
      "box": [
        16,
        680,
        175,
        14
      ],
      "canary": true,
      "canary_id": "CANARY8J3DQCHVEZHQDSPXV3UX64"
    }
  ],
  "tasks": []
}
