{
  "screen_id": "forms-016",
  "viewport": [
    1280,
    720
  ],
  "dpr": 1,
  "items": [
    {
      "entity": "USERNAME",
      "box": [
        220,
        120,
        200,
        24
      ],
      "value_hash": "sha256:a1ca37d7c12d6d0ac65fa9b559fe0ccec883ab57dc02396a02dc3d7da17a9177"
    },
    {
      "entity": "EMAIL",
      "box": [
        220,
        160,
        220,
        24
      ],
      "value_hash": "sha256:0cf6747e533fa1eca53b39a13d211dd06314a4d366a520ac3235f876ebe20f30"
    },
    {
      "entity": "UNKNOWN_SENSITIVE",
      "box": [
        16,
        680,
        260,
        16
      ],
      "canary": true,
      "canary_id": "CANARYEGACHUGCZRYCXPBE6WNPDT"
    }
  ],
  "tasks": []
}
