{
  "screen_id": "freetext-013",
  "viewport": [
    1280,
    720
  ],
  "dpr": 1,
  "items": [
    {
      "entity": "PERSON_NAME",
      "box": [
        16,
        60,
        109,
        22
      ],
      "value_hash": "sha256:fc242d6d0ba78e6a03024ba081a69f0652f6156f03b77687b10f7f44b54e58e9"
    },
    {
      "entity": "USERNAME",
      "box": [
        80,
        90,
        104,
        22
      ],
      "value_hash": "sha256:58bc7c54fcbcf476e0ac60f81ba836ee9444aab350fcf54a1c1a48e08e4db489"
    },
    {
      "entity": "UNKNOWN_SENSITIVE",
      "box": [
        16,
        680,
        182,
        14
      ],
      "canary": true,
      "canary_id": "CANARYXL5ECNW8QSEQWX2Y5ETB3M"
    }
  ],
  "tasks": []
}
