{
  "screen_id": "pdf-002",
  "viewport": [
    1280,
    720
  ],
  "dpr": 1,
  "items": [
    {
      "entity": "PERSON_NAME",
      "box": [
        120,
        180,
        220,
        22
      ],
      "value_hash": "sha256:24218cd8efc9ab721c8a1774547b2296332dfe6356d77c1ed4baf143afbc45b1"
    },
    {
      "entity": "EMAIL",
      "box": [
        120,
        210,
        220,
        22
      ],
      "value_hash": "sha256:357eed0065a294e99c0b810b676952d3f7aba69b04008945cd7e301ef8d99ace"
    },
    {
      "entity": "PHONE",
      "box": [
        120,
        240,
        200,
        22
      ],
      "value_hash": "sha256:e8c396b48298599cf6bd6c96dbe9eeda35590d79e3e2c489f083f7f2b6caf2e9"
    },
    {
      "entity": "UNKNOWN_SENSITIVE",
      "box": [
        16,
        680,
        260,
        16
      ],
      "canary": true,
      "canary_id": "CANARYX3Y78LSF222SFTFYKK22H5"
    }
  ],
  "tasks": []
}
