{
  "screen_id": "id-004",
  "viewport": [
    1280,
    720
  ],
  "dpr": 1,
  "items": [
    {
      "entity": "GSTIN",
      "box": [
        220,
        120,
        137,
        19
      ],
      "value_hash": "sha256:08327b4226ac4355aaaa72da1e9af39f011da8ec1262c46765f3c46e381d7353"
    },
    {
      "entity": "UNKNOWN_SENSITIVE",
      "box": [
        16,
        680,
        178,
        14
      ],
      "canary": true,
      "canary_id": "CANARYCAGW39F82W3ZGBC5FL9RCB"
    }
  ],
  "tasks": []
}
