{
  "screen_id": "id-009",
  "viewport": [
    1280,
    720
  ],
  "dpr": 1,
  "items": [
    {
      "entity": "AADHAAR",
      "box": [
        220,
        120,
        160,
        22
      ],
      "value_hash": "sha256:6085fe18bc2f661912921076646319a0238664e6caee976d77fce46b88501a4d"
    },
    {
      "entity": "UNKNOWN_SENSITIVE",
      "box": [
        16,
        680,
        260,
        16
      ],
      "canary": true,
      "canary_id": "CANARY44KBRERHZA4PNKD3JV6CFP"
    }
  ],
  "tasks": []
}
