{
  "screen_id": "indic-016",
  "viewport": [
    1280,
    720
  ],
  "dpr": 1,
  "items": [
    {
      "entity": "VEHICLE_REG",
      "box": [
        220,
        120,
        96,
        19
      ],
      "value_hash": "sha256:fd0cc7b325473db5ec6bb019b46af259af82e9986a4322401c54af20d23886b0"
    },
    {
      "entity": "UNKNOWN_SENSITIVE",
      "box": [
        16,
        680,
        170,
        14
      ],
      "canary": true,
      "canary_id": "CANARYN9A9JFSUZ9XMTAECEXVBXX"
    }
  ],
  "tasks": []
}
