{
  "screen_id": "pdf-003",
  "viewport": [
    1280,
    720
  ],
  "dpr": 1,
  "items": [
    {
      "entity": "PERSON_NAME",
      "box": [
        120,
        180,
        220,
        22
      ],
      "value_hash": "sha256:032cfe29d0711aa974aed82328e15d420e97029728f9986db5ec89337af7e6ab"
    },
    {
      "entity": "DOB",
      "box": [
        120,
        210,
        120,
        22
      ],
      "value_hash": "sha256:35811ac1c27b82783730f34052e471b7c09bff7dddc7ec507a17a8e30a8bf45f"
    },
    {
      "entity": "UNKNOWN_SENSITIVE",
      "box": [
        16,
        680,
        260,
        16
      ],
      "canary": true,
      "canary_id": "CANARYV8A3NS825AFYZQHFYBGUE5"
    }
  ],
  "tasks": []
}
