{
  "screen_id": "indic-014",
  "viewport": [
    1280,
    720
  ],
  "dpr": 1,
  "items": [
    {
      "entity": "PAN",
      "box": [
        220,
        120,
        90,
        19
      ],
      "value_hash": "sha256:8d2b9cca7792f9e001b19572fa6bd52ea1be76b01610591f5eeffe4ff3080e42"
    },
    {
      "entity": "UNKNOWN_SENSITIVE",
      "box": [
        16,
        680,
        179,
        14
      ],
      "canary": true,
      "canary_id": "CANARYQ58HW8BUL8NJR3FYQQLMFV"
    }
  ],
  "tasks": []
}
