{
  "screen_id": "email-009",
  "viewport": [
    1280,
    720
  ],
  "dpr": 1,
  "items": [
    {
      "entity": "EMAIL",
      "box": [
        220,
        120,
        260,
        22
      ],
      "value_hash": "sha256:1b5ab2b4c6c439b3a42f6556f94acaa4aa1110e7c0764da8f09aebf88cf9bcba"
    },
    {
      "entity": "PHONE",
      "box": [
        220,
        160,
        200,
        22
      ],
      "value_hash": "sha256:85760a152abc12f44249a1d884929b74cd66eb3f7b001bccdb6625f17aa64f51"
    },
    {
      "entity": "UNKNOWN_SENSITIVE",
      "box": [
        16,
        680,
        260,
        16
      ],
      "canary": true,
      "canary_id": "CANARY2MCF58JXDWREYY8JFYJ2L6"
    }
  ],
  "tasks": []
}
